{
  "kind": "atd_week",
  "season": 2026,
  "week": 6,
  "generated_utc": "2026-10-18T18:38:21Z",
  "adopted": true,
  "verdict": "ADOPTED \u2014 beats the position base rate and opportunity-only share on log loss and Brier in every held-out season (2023, 2024, 2025), calibration slope inside [0.9, 1.1] in each; team TDs within 5% over 2024-25",
  "backtest_generated_utc": "2026-10-13T14:53:58Z",
  "live_adjustment": null,
  "params": {
    "prev_w": 0.5,
    "k_team": 8.0,
    "k_share": 80.0,
    "k_opp": 1.0,
    "cascade_weeks": 3
  },
  "counts": {
    "app_players": 300,
    "not_playable": 42,
    "no_game": 34,
    "no_history_id": 0,
    "presumed_active_non_app": 198,
    "priced": 224
  },
  "players": [
    {
      "gsis_id": "espn-4241985",
      "nflverse_id": "00-0036158",
      "player": "J.K. Dobbins",
      "team": "DEN",
      "position": "RB",
      "market": "anytime_td",
      "game_id": "401872995",
      "side": "home",
      "selection": "J. Dobbins anytime TD",
      "model_prob": 0.2855,
      "raw_prob": 0.2855,
      "lambda_team": 2.007,
      "share": 0.1675,
      "has_history": true
    },
    {
      "gsis_id": "espn-4568490",
      "nflverse_id": "00-0040730",
      "player": "RJ Harvey",
      "team": "DEN",
      "position": "RB",
      "market": "anytime_td",
      "game_id": "401872995",
      "side": "home",
      "selection": "R. Harvey anytime TD",
      "model_prob": 0.2661,
      "raw_prob": 0.2661,
      "lambda_team": 2.007,
      "share": 0.1541,
      "has_history": true
    },
    {
      "gsis_id": "espn-4372016",
      "nflverse_id": "00-0036613",
      "player": "Jaylen Waddle",
      "team": "DEN",
      "position": "WR",
      "market": "anytime_td",
      "game_id": "401872995",
      "side": "home",
      "selection": "J. Waddle anytime TD",
      "model_prob": 0.2079,
      "raw_prob": 0.2079,
      "lambda_team": 2.007,
      "share": 0.1161,
      "has_history": true
    },
    {
      "gsis_id": "espn-3128429",
      "nflverse_id": "00-0034348",
      "player": "Courtland Sutton",
      "team": "DEN",
      "position": "WR",
      "market": "anytime_td",
      "game_id": "401872995",
      "side": "home",
      "selection": "C. Sutton anytime TD",
      "model_prob": 0.1968,
      "raw_prob": 0.1968,
      "lambda_team": 2.007,
      "share": 0.1092,
      "has_history": true
    },
    {
      "gsis_id": "espn-4431280",
      "nflverse_id": "00-0039868",
      "player": "Troy Franklin",
      "team": "DEN",
      "position": "WR",
      "market": "anytime_td",
      "game_id": "401872995",
      "side": "home",
      "selection": "T. Franklin anytime TD",
      "model_prob": 0.1406,
      "raw_prob": 0.1406,
      "lambda_team": 2.007,
      "share": 0.0755,
      "has_history": true
    },
    {
      "gsis_id": "espn-4426338",
      "nflverse_id": "00-0039732",
      "player": "Bo Nix",
      "team": "DEN",
      "position": "QB",
      "market": "anytime_td",
      "game_id": "401872995",
      "side": "home",
      "selection": "B. Nix anytime TD",
      "model_prob": 0.1258,
      "raw_prob": 0.1258,
      "lambda_team": 2.007,
      "share": 0.067,
      "has_history": true
    },
    {
      "gsis_id": "espn-3051876",
      "nflverse_id": "00-0033881",
      "player": "Evan Engram",
      "team": "DEN",
      "position": "TE",
      "market": "anytime_td",
      "game_id": "401872995",
      "side": "home",
      "selection": "E. Engram anytime TD",
      "model_prob": 0.1152,
      "raw_prob": 0.1152,
      "lambda_team": 2.007,
      "share": 0.061,
      "has_history": true
    },
    {
      "gsis_id": "espn-4600981",
      "nflverse_id": "00-0040134",
      "player": "Pat Bryant",
      "team": "DEN",
      "position": "WR",
      "market": "anytime_td",
      "game_id": "401872995",
      "side": "home",
      "selection": "P. Bryant anytime TD",
      "model_prob": 0.0995,
      "raw_prob": 0.0995,
      "lambda_team": 2.007,
      "share": 0.0522,
      "has_history": true
    },
    {
      "gsis_id": "espn-4686472",
      "nflverse_id": "00-0038976",
      "player": "Marvin Mims Jr.",
      "team": "DEN",
      "position": "WR",
      "market": "anytime_td",
      "game_id": "401872995",
      "side": "home",
      "selection": "M. Mims Jr. anytime TD",
      "model_prob": 0.0954,
      "raw_prob": 0.0954,
      "lambda_team": 2.007,
      "share": 0.0499,
      "has_history": true
    },
    {
      "gsis_id": "espn-4039057",
      "nflverse_id": "00-0035406",
      "player": "Lil'Jordan Humphrey",
      "team": "DEN",
      "position": "WR",
      "market": "anytime_td",
      "game_id": "401872995",
      "side": "home",
      "selection": "L. Humphrey anytime TD",
      "model_prob": 0.067,
      "raw_prob": 0.067,
      "lambda_team": 2.007,
      "share": 0.0345,
      "has_history": true
    },
    {
      "gsis_id": "espn-4430878",
      "nflverse_id": "00-0038543",
      "player": "Jaxon Smith-Njigba",
      "team": "SEA",
      "position": "WR",
      "market": "anytime_td",
      "game_id": "401872995",
      "side": "away",
      "selection": "J. Smith-Njigba anytime TD",
      "model_prob": 0.4094,
      "raw_prob": 0.4094,
      "lambda_team": 2.2326,
      "share": 0.2359,
      "has_history": true
    },
    {
      "gsis_id": "espn-4887558",
      "nflverse_id": "00-0038797",
      "player": "Emanuel Wilson",
      "team": "SEA",
      "position": "RB",
      "market": "anytime_td",
      "game_id": "401872995",
      "side": "away",
      "selection": "E. Wilson anytime TD",
      "model_prob": 0.2881,
      "raw_prob": 0.2881,
      "lambda_team": 2.2326,
      "share": 0.1522,
      "has_history": true
    },
    {
      "gsis_id": "espn-4576297",
      "nflverse_id": "00-0039793",
      "player": "AJ Barner",
      "team": "SEA",
      "position": "TE",
      "market": "anytime_td",
      "game_id": "401872995",
      "side": "away",
      "selection": "A. Barner anytime TD",
      "model_prob": 0.1945,
      "raw_prob": 0.1945,
      "lambda_team": 2.2326,
      "share": 0.0969,
      "has_history": true
    },
    {
      "gsis_id": "espn-4032473",
      "nflverse_id": "00-0037545",
      "player": "Rashid Shaheed",
      "team": "SEA",
      "position": "WR",
      "market": "anytime_td",
      "game_id": "401872995",
      "side": "away",
      "selection": "R. Shaheed anytime TD",
      "model_prob": 0.1793,
      "raw_prob": 0.1793,
      "lambda_team": 2.2326,
      "share": 0.0885,
      "has_history": true
    },
    {
      "gsis_id": "espn-2977187",
      "nflverse_id": "00-0033908",
      "player": "Cooper Kupp",
      "team": "SEA",
      "position": "WR",
      "market": "anytime_td",
      "game_id": "401872995",
      "side": "away",
      "selection": "C. Kupp anytime TD",
      "model_prob": 0.1464,
      "raw_prob": 0.1464,
      "lambda_team": 2.2326,
      "share": 0.0709,
      "has_history": true
    },
    {
      "gsis_id": "espn-4597703",
      "nflverse_id": "00-0040648",
      "player": "Tory Horton",
      "team": "SEA",
      "position": "WR",
      "market": "anytime_td",
      "game_id": "401872995",
      "side": "away",
      "selection": "T. Horton anytime TD",
      "model_prob": 0.1298,
      "raw_prob": 0.1298,
      "lambda_team": 2.2326,
      "share": 0.0623,
      "has_history": true
    },
    {
      "gsis_id": "espn-3912547",
      "nflverse_id": "00-0034869",
      "player": "Sam Darnold",
      "team": "SEA",
      "position": "QB",
      "market": "anytime_td",
      "game_id": "401872995",
      "side": "away",
      "selection": "S. Darnold anytime TD",
      "model_prob": 0.0485,
      "raw_prob": 0.0485,
      "lambda_team": 2.2326,
      "share": 0.0223,
      "has_history": true
    },
    {
      "gsis_id": "espn-4429059",
      "nflverse_id": "00-0040583",
      "player": "Woody Marks",
      "team": "HOU",
      "position": "RB",
      "market": "anytime_td",
      "game_id": "401872996",
      "side": "away",
      "selection": "W. Marks anytime TD",
      "model_prob": 0.2081,
      "raw_prob": 0.2081,
      "lambda_team": 1.8385,
      "share": 0.1269,
      "has_history": true
    },
    {
      "gsis_id": "espn-4258173",
      "nflverse_id": "00-0036554",
      "player": "Nico Collins",
      "team": "HOU",
      "position": "WR",
      "market": "anytime_td",
      "game_id": "401872996",
      "side": "away",
      "selection": "N. Collins anytime TD",
      "model_prob": 0.2047,
      "raw_prob": 0.2047,
      "lambda_team": 1.8385,
      "share": 0.1246,
      "has_history": true
    },
    {
      "gsis_id": "espn-4035538",
      "nflverse_id": "00-0035685",
      "player": "David Montgomery",
      "team": "HOU",
      "position": "RB",
      "market": "anytime_td",
      "game_id": "401872996",
      "side": "away",
      "selection": "D. Montgomery anytime TD",
      "model_prob": 0.1931,
      "raw_prob": 0.1931,
      "lambda_team": 1.8385,
      "share": 0.1167,
      "has_history": true
    },
    {
      "gsis_id": "espn-4429939",
      "nflverse_id": "00-0039405",
      "player": "Jawhar Jordan",
      "team": "HOU",
      "position": "RB",
      "market": "anytime_td",
      "game_id": "401872996",
      "side": "away",
      "selection": "J. Jordan anytime TD",
      "model_prob": 0.1607,
      "raw_prob": 0.1607,
      "lambda_team": 1.8385,
      "share": 0.0953,
      "has_history": true
    },
    {
      "gsis_id": "espn-4432708",
      "nflverse_id": "00-0039849",
      "player": "Marvin Harrison Jr.",
      "team": "HOU",
      "position": "WR",
      "market": "anytime_td",
      "game_id": "401872996",
      "side": "away",
      "selection": "M. Harrison Jr. anytime TD",
      "model_prob": 0.12,
      "raw_prob": 0.12,
      "lambda_team": 1.8385,
      "share": 0.0695,
      "has_history": true
    },
    {
      "gsis_id": "espn-3117256",
      "nflverse_id": "00-0034383",
      "player": "Dalton Schultz",